{
  "schemaVersion": 1,
  "rulesetVersion": "1.0.0",
  "regexTimeoutMilliseconds": 250,
  "patterns": [
    {
      "id": "GeneralCredentialLanguageRegex",
      "pattern": "\\b(?:certification|certifications|certified|credential|credentials|professional\\s+licen[cs]e|professional\\s+licensure|licen[cs]ed\\s+[A-Za-z]+)\\b"
    },
    {
      "id": "IgnoredGeneralLanguageRegex",
      "pattern": "\\bassistance\\s+with\\s+obtaining\\s+pertinent\\s+certifications\\b|\\bcertification\\s+(?:activities|packages|authority)\\b|\\bfacility\\s+credentials?\\s*/\\s*authorization\\b|\\bcertificate\\s+management\\b|\\blicen[cs]ed\\s+software\\b|\\bidentity,?\\s+credential,?\\s+and\\s+access\\s+management\\b|\\bOEM\\s+certified\\s+technician\\b|^must\\s+have\\s+required\\s+certifications?\\s+to\\s+be\\s+considered\\s*:?$|^possession\\s+of\\s+one\\s+or\\s+more\\s+of\\s+the\\s+following\\s+industry-recognized\\s+certifications?\\s*:?$"
    }
  ]
}
